{
  "kicker": "가나다라마바사아자차카타파하가나",
  "title": "가나다라마바사아자차카타파하가나다라마바사아자차카타파하가나다라마바사아자차카타",
  "center": "가나다라마바",
  "nodes": [
    {
      "ini": "가나",
      "name": "가나다라마바사아자차카타"
    },
    {
      "ini": "다라",
      "name": "가나다라마바사아자차카타"
    },
    {
      "ini": "마바",
      "name": "가나다라마바사아자차카타"
    },
    {
      "ini": "사아",
      "name": "가나다라마바사아자차카타"
    },
    {
      "ini": "자차",
      "name": "가나다라마바사아자차카타"
    },
    {
      "ini": "카타",
      "name": "가나다라마바사아자차카타"
    },
    {
      "ini": "파하",
      "name": "가나다라마바사아자차카타"
    },
    {
      "ini": "가나",
      "name": "가나다라마바사아자차카타"
    }
  ],
  "rounds": [
    {
      "chip": "R1",
      "name": "가나다라마바사아자차카타파하",
      "desc": "가나다라마바사아자차카타파하가나다라마바사아자차카타파하가나다라마바사아자차카타"
    },
    {
      "chip": "R2",
      "name": "가나다라마바사아자차카타파하",
      "desc": "가나다라마바사아자차카타파하가나다라마바사아자차카타파하가나다라마바사아자차카타"
    },
    {
      "chip": "R3",
      "name": "가나다라마바사아자차카타파하",
      "desc": "가나다라마바사아자차카타파하가나다라마바사아자차카타파하가나다라마바사아자차카타"
    },
    {
      "chip": "R4",
      "name": "가나다라마바사아자차카타파하",
      "desc": "가나다라마바사아자차카타파하가나다라마바사아자차카타파하가나다라마바사아자차카타"
    }
  ],
  "outcome": {
    "title": "가나다라마바사아자차카타파하",
    "desc": "가나다라마바사아자차카타파하가나다라마바사아자차카타파하가나다라마바사아자차카타"
  },
  "frame": {
    "brand": "가나다라마바사아자차카타파하가나다라마바사아자차",
    "idx": "03",
    "total": "07"
  }
}
