{
  "kicker": "접근",
  "title": "개념 제목",
  "center": "중심",
  "nodes": [
    {
      "ini": "일",
      "name": "노드일"
    },
    {
      "ini": "이",
      "name": "노드이"
    },
    {
      "ini": "삼",
      "name": "노드삼"
    },
    {
      "ini": "사",
      "name": "노드사"
    }
  ],
  "rounds": [
    {
      "chip": "R1",
      "name": "라운드일",
      "desc": "설명 일"
    },
    {
      "chip": "R2",
      "name": "라운드이",
      "desc": "설명 이"
    }
  ]
}
