{
  "kicker": "HWAX의 접근",
  "title": "여러 전문가가, 여러 라운드에 걸쳐 토론합니다",
  "center": "질문",
  "nodes": [
    {
      "ini": "재",
      "name": "재료역학"
    },
    {
      "ini": "공",
      "name": "패키징 공정"
    },
    {
      "ini": "신",
      "name": "신뢰성"
    },
    {
      "ini": "열",
      "name": "열 해석"
    },
    {
      "ini": "품",
      "name": "품질·VOC"
    },
    {
      "ini": "설",
      "name": "설계"
    }
  ],
  "rounds": [
    {
      "chip": "R1",
      "name": "초기 입장",
      "desc": "전 전문가 병렬 발언 — 관점·데이터 해석·권장안"
    },
    {
      "chip": "R2",
      "name": "상호 반박",
      "desc": "수치·표준·실패모드 근거 반박, “두루뭉술 금지”"
    },
    {
      "chip": "R3",
      "name": "수렴 · 표결",
      "desc": "양보 불가 제약 명시, 동의/조건부/반대 집계"
    }
  ],
  "outcome": {
    "title": "의장 의사결정문",
    "desc": "결론 · 합의 근거 · 반대의견 · 미해결 쟁점"
  },
  "frame": {
    "brand": "HWAX 협업진단 플랫폼",
    "total": "07",
    "idx": "03"
  }
}
